{"schema_version":1,"product_id":"spectra","customer_id":"CUS-SYNTHETIC-04","workspace_id":"WS-SYNTHETIC-04","project_id":"PRJ-MIGRATION-01","project_type":"migration","predecessor":{"customer_id":"CUS-SYNTHETIC-04","project_id":"PRJ-LEGACY-01"},"product_binding":{"version":"1.2.0-alpha.12","release_tag":"spectra-v1.2.0-alpha.12","manifest_path":"release/versions/1.2.0-alpha.12/release-manifest.json"},"business_central":{"operation_mode":"online","country":"DE","localization":"DE","environment_roles":["sandbox","production"]},"atlassian":{"mode":"manual-materialization","live_apply":false},"data_boundary":{"classification":"confidential","retention_policy":"migration-policy","external_file_intake":"proposal-only","secret_references":["MIGRATION_SOURCE_SECRET"]},"recovery":{"backup_required":true,"restore_test_required":true,"uninstall_preserves_workspace":true}}
