{"schema_version":1,"product_id":"spectra","customer_id":"CUS-SYNTHETIC-03","workspace_id":"WS-SYNTHETIC-03","project_id":"PRJ-FIT-GAP-01","project_type":"fit-gap","predecessor":null,"product_binding":{"version":"1.2.0-alpha.12","release_tag":"spectra-v1.2.0-alpha.12","manifest_path":"release/versions/1.2.0-alpha.12/release-manifest.json"},"business_central":{"operation_mode":"online","country":"DE","localization":"DE","environment_roles":["sandbox"]},"atlassian":{"mode":"simulated","live_apply":false},"data_boundary":{"classification":"synthetic","retention_policy":"assessment-policy","external_file_intake":"proposal-only","secret_references":[]},"recovery":{"backup_required":true,"restore_test_required":true,"uninstall_preserves_workspace":true}}
