{"schema_version":1,"product_id":"spectra","customer_id":"CUS-SYNTHETIC-02","workspace_id":"WS-SYNTHETIC-02","project_id":"PRJ-SUPPORT-01","project_type":"support-only","predecessor":null,"product_binding":{"version":"1.2.0-alpha.12","release_tag":"spectra-v1.2.0-alpha.12","manifest_path":"release/versions/1.2.0-alpha.12/release-manifest.json"},"business_central":{"operation_mode":"on-prem","country":"DE","localization":"DE","environment_roles":["production","test"]},"atlassian":{"mode":"manual-materialization","live_apply":false},"data_boundary":{"classification":"internal","retention_policy":"support-policy","external_file_intake":"proposal-only","secret_references":[]},"recovery":{"backup_required":true,"restore_test_required":true,"uninstall_preserves_workspace":true}}
