{"schema_version":1,"product_id":"spectra","customer_id":"CUS-SYNTHETIC-01","workspace_id":"WS-SYNTHETIC-01","project_id":"PRJ-IMPLEMENTATION-01","project_type":"implementation","predecessor":null,"product_binding":{"version":"1.2.0-alpha.12","release_tag":"spectra-v1.2.0-alpha.12","manifest_path":"release/versions/1.2.0-alpha.12/release-manifest.json"},"business_central":{"operation_mode":"online","country":"DE","localization":"DE","environment_roles":["sandbox","production"]},"atlassian":{"mode":"simulated","live_apply":false},"data_boundary":{"classification":"synthetic","retention_policy":"project-policy","external_file_intake":"proposal-only","secret_references":["SPECTRA_RUNTIME_SECRET"]},"recovery":{"backup_required":true,"restore_test_required":true,"uninstall_preserves_workspace":true}}
